,Symbol,Name,Current Price,Current IV,SMA200,SMA50,Price Percentile 13W,Price Percentile 52W,Price Rank 13W,Price Rank 52W,Price Change 13W,Price Change 52W,IV Percentile 13W,IV Percentile 52W,IV Rank 13W,IV Rank 52W,Market Cap
3,AVGO,Broadcom Inc. Common Stock,$297.39,46.00,$226.94,$287.25,75.00%,94.00%,73.82,89.06,20.00%,95.00%,67.00%,57.00%,63.79,25.77,1382820467826.0
8,TSLA,Tesla Inc. Common Stock,$333.87,43.00,$330.04,$323.79,76.00%,63.00%,71.93,44.54,-3.00%,59.00%,0.00%,0.00%,0.79,0.49,1096684876749.0
7,PLTR,Palantir Technologies Inc. Class A Common Stock,$156.71,48.00,$108.99,$155.52,65.00%,91.00%,53.15,79.28,19.00%,414.00%,19.00%,13.00%,17.56,21.46,376585635910.0
4,BABA,Alibaba Group Holding Limited American Depositary Shares each representing eight Ordinary share,$135.00,40.00,$111.91,$117.58,98.00%,93.00%,94.99,80.36,18.00%,64.00%,45.00%,41.00%,57.12,23.45,283902817304.0
0,AMD,Advanced Micro Devices Inc. Common Stock,$162.63,40.00,$125.34,$159.15,59.00%,85.00%,68.24,78.20,42.00%,19.00%,10.00%,19.00%,8.07,10.30,272248257267.0
1,ANET,Arista Networks Inc. Common Stock,$136.55,40.00,$101.75,$117.97,86.00%,96.00%,90.36,93.41,52.00%,67.00%,21.00%,28.00%,17.87,21.19,167477312018.0
5,GEV,GE Vernova Inc. Common Stock,$612.97,41.00,$421.95,$588.97,63.00%,91.00%,70.58,86.87,26.00%,218.00%,3.00%,1.00%,8.76,3.35,165258987256.0
2,APP,Applovin Corporation Class A Common Stock,$478.59,56.00,$346.48,$387.12,97.00%,98.00%,94.01,89.48,19.00%,443.00%,19.00%,14.00%,36.70,6.65,149398222016.0
6,MU,Micron Technology Inc. Common Stock,$119.01,53.00,$100.16,$118.21,56.00%,89.00%,69.42,84.13,21.00%,34.00%,73.00%,61.00%,69.02,30.65,131698641886.0
